{
  "$schema": "../schemas/groups.schema.json",
  "schema_version": "1.0.0",
  "document_id": "relution.groups",
  "document_type": "group_registry",
  "product": "Relution MDM",
  "as_of": "2026-07-18",
  "scope": {
    "intended_use": "Machine-readable device-group, membership, policy-assignment, automation, user-targeting, and additive-permission guidance for an operator or automation client before binding a concept to a target-instance OpenAPI operation.",
    "not_authoritative_for": ["Exact API methods, paths, parameters, schemas, filter operators, or responses", "Target release activation or migration state", "Current membership, assignment, action, or permission state", "External-directory source-of-truth behavior not proven on the target"]
  },
  "completeness": {
    "level": "stable_capability_map",
    "coverage_basis": "First-party Relution device-group, user-based policy, device-group action, and permission documentation available on 2026-07-18, organized into eight stable operational concepts.",
    "known_exclusions": ["Exact target contract operation bindings", "Release-specific filter field and operator schemas", "Customer-defined group filters, actions, schedules, and permission sets", "Education-class behavior beyond user/security group scope"],
    "contract_boundary": "Every method, path, identifier, filter schema, action payload, schedule representation, and permission wire value remains unresolved until the OpenAPI JSON exported from the exact target instance is supplied."
  },
  "records": [
    {
      "id": "group.device.model",
      "record_kind": "device_group_model",
      "name": "Device group model",
      "summary": "A Relution device group links devices with policies either manually as a static group or automatically from device properties as a dynamic group; groups are platform-independent even though policies and actions may be platform-specific.",
      "capabilities": ["Create a named device group with an optional description", "Choose Static or Dynamic as the group type", "Link devices and policies through the group model", "Use group membership as a policy-distribution audience", "Attach event-based or scheduled actions where supported", "Keep platform-independent membership distinct from platform-specific policy and action applicability"],
      "prerequisites": ["Confirm device-group functionality is active on the target release", "Resolve organization and group type", "Inventory all attached policies, actions, schedules, and downstream group references", "Define expected membership and platform mix"],
      "sensitive_value_classes": ["Device identifiers and properties", "Assigned users", "Group membership", "Policy and action assignments", "Filter criteria"],
      "platforms": ["cross_platform", "ios_ipados", "macos", "tvos", "android_classic_legacy", "android_enterprise", "windows"],
      "scope": {"levels": ["organization", "group", "user", "device", "fleet"], "organization_behavior": "Device groups are administered within an organization and can affect every current and future device member through attached policies and actions."},
      "risk": {"tier": "critical", "reasons": ["Membership changes can activate or remove policies", "Group actions can run immediately or repeatedly", "Platform-independent groups may contain devices that cannot apply every linked policy or action"], "blast_radius": "One explicitly changed member or every current and future member of the selected group."},
      "approval": {"level": "explicit_immediate_approval", "required_for": ["Group creation, duplication, type or filter changes, activation, or deletion", "Membership changes when policies or actions are attached", "Policy, event-action, or schedule attachment"]},
      "mutation": {"possible": true, "effects": ["Create, update, duplicate, activate, or delete a device group", "Change membership, filters, policy links, actions, and schedules"], "external_effects": ["Can deliver or remove device configuration and trigger device or webhook actions"], "destructive_effects": ["Attached actions can delete, wipe, lock, reset, or otherwise disrupt devices", "Removing critical policies can break management connectivity"], "concurrency_cautions": ["Re-read membership and all attachments immediately before mutation", "Do not treat group creation as isolated when copied policies or actions are included", "Evaluate platform applicability per member"]},
      "verification": {"preconditions": ["Resolve group ID, type, organization, active state, membership, filters, policies, actions, schedules, and dependencies", "Freeze expected member set"], "read_back": ["Read direct group state, computed or manual membership, attached policies, actions, and schedules independently"], "audit": ["Match group, membership, policy-link, action, and schedule events to the actor and organization"], "functional_checks": ["Verify one approved pilot device receives only the intended compatible effects"], "stop_conditions": ["Group type is ambiguous", "Membership changes outside the expected set", "An attached effect was not analyzed", "A device loses baseline connectivity or management"]},
      "rollback": {"strategy": "manual_recovery", "requirements": ["Capture group definition, membership or filter tree, attachments, dependencies, and active state", "Preserve a known-good connectivity policy", "Prepare action-specific compensation"], "limitations": ["Executed actions and removed device data may be irreversible", "Dynamic membership may change again after restoration"]},
      "related_ids": {"features": ["feature.device_groups", "feature.policy_management", "feature.group_automation"], "settings": ["setting.mdm.core"], "policies": ["policy.assignment.device_group", "policy.status.application"], "groups": ["group.device.static", "group.device.dynamic", "group.device.policy_assignment", "group.device.automation_event", "group.device.automation_schedule"]},
      "api_discovery": {"binding_status": "target_contract_required", "operation_id": null, "method": null, "path": null, "request_schema_ref": null, "response_schema_ref": null, "tags": ["Device groups", "Devices", "Policies"], "search_terms": ["device group", "group type", "static", "dynamic", "membership", "active"], "contract_checks": ["Locate group definition, membership, filter, policy, action, and schedule operations separately", "Confirm organization scope and immutable group-type behavior", "Inspect duplicate and activation semantics for the target release"]},
      "evidence": [{"class": "official_documentation", "url": "https://hub.relution.io/en/docs/general/devicemanagement/devicegroups/", "claim": "Relution documents device groups as links between devices and policies, with Static and Dynamic group types and manual or property-based membership.", "accessed_at": "2026-07-18"}, {"class": "official_documentation", "url": "https://hub.relution.io/en/docs/general/devicemanagement/actions-groups-overview/", "claim": "Relution documents that device groups are platform-independent and can trigger policies, actions, and scheduled jobs.", "accessed_at": "2026-07-18"}]
    },
    {
      "id": "group.device.static",
      "record_kind": "device_group_membership",
      "name": "Static device group membership",
      "summary": "A static device group has manually managed device membership and manually linked policies; only policies that were already published can be linked.",
      "capabilities": ["Add or remove individual devices manually", "Link or unlink previously published policies manually", "Bulk-add or bulk-remove selected devices from an existing static group in supported releases", "Expose newly added devices to every associated policy", "Preserve membership until an administrator changes it"],
      "prerequisites": ["Resolve exact static group ID and organization", "Confirm every policy link references a published policy", "Freeze the selected device set", "Review all policies, actions, and schedules attached to the group"],
      "sensitive_value_classes": ["Device identifiers", "Group membership", "Policy assignments", "User and inventory attributes"],
      "platforms": ["cross_platform", "ios_ipados", "macos", "tvos", "android_classic_legacy", "android_enterprise", "windows"],
      "scope": {"levels": ["organization", "group", "device", "fleet"], "organization_behavior": "Manual membership and policy links operate within one organization; every selected device inherits the group's compatible attached effects."},
      "risk": {"tier": "critical", "reasons": ["Adding a device can immediately expose it to every linked policy and action", "Bulk membership changes can expand the blast radius", "Unpublished policy links are invalid according to the documented model"], "blast_radius": "One device by default, or every explicitly selected device in an approved bulk membership operation."},
      "approval": {"level": "explicit_immediate_approval", "required_for": ["Adding or removing a device when effects are attached", "Any bulk membership change", "Linking or unlinking a policy", "Deleting the group"]},
      "mutation": {"possible": true, "effects": ["Add or remove manual device membership", "Link or unlink published policies"], "external_effects": ["Membership activates or removes attached policy and action effects on devices"], "destructive_effects": ["Removal can revoke critical policy configuration", "Attached actions may have destructive effects"], "concurrency_cautions": ["Re-read group attachments and selected devices immediately before change", "Do not infer that bulk membership is atomic or idempotent without the target contract", "Inspect per-device results"]},